fake	effondrement besoin homme bon actuellement mode dénigrer importance biologie peutêtre temps humain vivre animal soumettre caprice nature technologie contrôler naissance fécondation in vitro accouchement césarien soin intensif naissance prématuré suite tentative faire valoir fin compter groupe animal civilisation condition temporaire chance recevoir aspect tendre fortement contester déterminisme biologique voir différence sexuel idéologie officiel devoir croire homme femme capacité choser juger coupable perpétuation stéréotype sexuel acte employer blanc google récemment découvrir considérer cause résiliation contrat travail immédiat civilisation technologique approcher fin vie raison épuisement ressourcer renouvelable perturbation environnemental dévastateur réalité cascader typique effondrement financier commercial politique social culturel risquer fort différence sexuel redevenir évident important étude genre théorie féministe disparaître doucement oubli essayer déterminer adaptation social culturel susceptible propice survivre effondrement approcher essentiel justifier femme devoir compter homme grand nombrer chose sortir vieux fille veuf enviable femme moderne trouver perspective revenir momentslà effroyable victoire politique récent matière égalité sexe protéger filet politique déjà effilocher indépendance économique rendre filet économique distendre également devrontelles rabattre admettre presque scénario effondrement imaginable femme devoir compter homme question poser homme femme moderne économiquement indépendant libérer besoin considérablement réduire conjoindre masculin don sperme opportun réellement requis camaraderie romance aider élever enfant souhaitable facultatif besoin fortement réduire venir sen réduire responsabilité réponse homme moderne concentrer propre besoin femme choisir rester égoïste enfantin aller chercher femme femme encore … femme ndt sorte événement transformateur devoir lieu homme accepter fardeau traditionnel responsabilité masculin transformation estelle sommesnous prêt admettre scénario effondrement société moderne disparaître société traditionnel société moderne considérer arriérer sortir disposer faire compromettre principe précieux donner chance sortir justification tenter simplement imiter rôle genre traditionnel stéréotyper stade paraître irrationnel accouchement homme femme devraientils assumer rôle distinct existetil facteur biologique favoriser spécialisation sexuel terme survie affirmatif sontils recherche montrer caractéristique sexuel primaire secondaire organe porter signe clair différenciation sexuel organe importer cerveau femme cerveau homme structurellement brainl atmosphère politiquement charger actuel vie difficile étudier différence sexuel chercheur travailler chercheur université edimbourg découvrir femme tendance cortex épais homme cortex épais associer score élever test intelligence cognitif général temps homme volume cérébral élever femme région souscorticale hippocampe jouer rôle importer mémoire conscience spatial amygdale émotion mémoire pris décision striatum apprentissage inhibition traitement récompenser thalamus traitement transmission information sensoriel partir cerveau impliquer clair clairement différence structurel impliquer différence fonctionnel pouvoir penser exemple cortex significativement épais servir fonction inhibiteur rendre femme sujet violence volume cérébral supérieur … région souscorticale donner homme étrange capacité tirer poser question ensuite prouver différence provenir génétique mâle posséder chromosome cas femelle présence chromosome traduire développement pris embryon conception cas garçon immédiatement naissance lorsqu pousser hormonal provoquer développement cerveau spécifiquement masculin avérer crucial chromosome sorte terrain jeu évolutif propriété curieux partir soumettre mécanisme contrôler erreur génétique pair xx – femme – jamais pair yy exprimer facilement mutation grand majorité mutation aboutir spécimen anormal simplement inférieur égard temps retrouver bouddha moïse einstein recherche antérieur déclarer politiquement incorrect porter tenter trouver preuve différence intelligence global homme femme question perte temps preuve concluant logique supposer chose égal homme femme intelligence général équivalent distinction important homme intelligence moyen femme homme intelligence inférieur moyen intelligence supérieur moyen femme confirmer étude antérieur trouver différence moyen intelligence homme grand variabilité femme … citer stuart ritchie chef projet constatation cerveau participant masculin cas variable cerveau participant intéressant correspondre preuve indiquer homme variable physiquement mentalement déterminisme biologique immédiatement hérisser technologie exister transformer garçon fille fille garçon cerveau merveilleusement malléable adaptable garçon décider fille vice versa donnezlui simplement droguer chirurgie savoir faire différence exister différence caractère suicidaire élever tau dépression élever probabilité faible former succès famille probabilité nul succès reproductif effet secondaire indésirable ignorer présence absence chromosome rapport problème social associer nouveauté technologie impliquer conséquence utilisation connaître principe précaution exiger celleci sévèrement restreindre considération important garçon garçon fille fille simple précaution grand variabilité mâle espèce facteur clé adaptation humain étude chromosome publier nature trouver preuve ancêtre génétique commun mâle moderne vivre an afrique épisode récurrent homme humain posséder mutation virtuellement prendre charge ensemble pool génétique catapulter concurrent pool génétique génération événement genre produire an région europe an amérique nord sud pousser expansion extrême nombrer homme survenir indépendamment superpopulations continental examiner époque migration connaître innovation technologique accompagner percer technologique domaine clé métallurgie agriculture architecturer monumental guerre événement récent nature similaire tau changement accélérer point sorte analyser génétique considérer tau mutation longue période exemple horrible massacrer guerre trancher cour guerre mondial anéantir couche social paysan ouvrer travailleur industriel agriculture mécaniser logique demander rôle jouer chromosome développement fasciner vraiment question rôle jouer chromosome fin civilisation industriel combustible fossile ressource renouvelable devenir indisponible machine industriel arrêter repenser lointain ancêtre temps mutation chromosome permettre homme développer capacité fondre métal faire alliage cuivrer étain suite continuer tailler pierre éteindre processus vatil régresser atil trait capacité spécifiquement masculin devenir précieux scénario effondrement grand variabilité mâle peutelle sauver espèce extinction processus social permettre reprendre question partir
fake	inde estimer propre programme énergie libre question fierté national peur risquer mettre pays pétrodollar apporter soutien générateur ac réaction synchrone rlg inventer propre citoyen paramahamsa tewari ingénieur électricien ancien directeur exécutif nuclear power corporation of india année tewari démontrer théorie intérieur moteur homopolaire bruce palmer exposer écrivain monde technologie énergie libre évidence pays mettre œuvre propre programmer énergie libre compter conséquence intervention militaire pays pétrodollar exemple arabie saoudite royaumeuni étatsunis inde aligner propre programme militaire russie actuellement tenir pays brics cabaler nazioniste imposer sorte sanction détruire alliance brics promettre libérer technologie supprimer exemple énergie libre utilisation responsable dire respecter dernier nouveau générateur overunité réaction inventer inde ère génération passer machine alimenter puissance disponible poindre univers – nikola tesla évolution collectif générateur synchrone ac réaction rlg inventer paramahamsa tewari ingénieur électricien ancien directeur exécutif nuclear power corporation of india expérience comprendre gestion projet ingéniérie construction central nucléaire efficacité modeler construire également construire tester indépendant élever novembre visiter laboratoire paramahamsa tewari baser conception rlg septembre tewari montrer conducteur rigide pied long tourner centrer relier extrémité fil petit calibrer circuit magnétique placer conducteur laisser circuler courant travers conducteur tourner raison pression induit conducteur fonction régler théorie standard flamand vérifier expérience aube ère électrique simple réarrangement circuit magnétique courir produire rotation – pression torque annuler tard dupliquer configuration expérience établir ingénieux conduire percer invention générateur réaction efficacité grand expérience conduire conception essai appareil rendement supérieur conception précédent conception utiliser type matériau utiliser générateur courant circuit magnétique machiner configurer annuler pression torque induire courir production énergie comparer réorganisation matériau frère wright construire surface vol aboutir vol humain époque impossible scientifique physicien cramponner modèle désuet propriété structure espacer déclarer tewari impossible
trusted	appeler french connection membre bande mineur interpeller jeudi petit matin quartier sensible duchère lyon vaste opération policer âgé an jeune homme soupçonner semé terreur quartier an demi trouble ordre public dégradation menace … actuellement recherché rodéo barbecue publique agir bande constituer revendiquer assurer commissaire divisionnaire marianne charretlassagne chef sûreté départemental rhône vanter vouloir reprendre contrôle quartier premier alerte émaner an demi réunion acteur socioéconomiques zoner sécurité prioritaire départ riverain plaindre multiplication incivilité injure tags rapidement bander accentuer visibilité organiser rodéo plein ruer barbecue publique poursuivre commissaire divisionnaire rixe lycée interpellation sérier salle principal mjc quartier dégrader bibliothèque commerçant affirmer subir vol dégradation façade menacer pourtant plaindre tarder venir bande terroriser quartier insister marianne charretlassagne riverain élever voix protester insulter menacer moi préférer taire peur représaille enquêter prendre tournant vendredi septembre suite rixe faillir tourner drame ecully commune jouxte arrondissement lyon originer pourtant motif dérisoire bousculade involontaire lycée professionnel premier élément enquête laisser penser lycéen bousculer appeler grand frère justement parti bande poursuivre commissaire divisionnaire lire grigny frère blesser baller grand borner décéder midi quinzaine jeune homme membre french connection attendre lycéen origine bousculade vidéo caméra surveillance montrer porteur clé piper matraque télescopique couteau sentiment jouer football prendre tête ballon lycéen viser cible véritable déchaînement violence chef sûreté départemental interpeller confier sentiment jouer football prendre tête ballon ado parvenir échapper justesse coup couteau niveau carotide membre bander sentiment impunité assurer marianne charretlassagne nier présence lieu simplement sentiment participer bagarre analyser image vidéosurveillance permettre déclencher opération policer interpeller seul mineur inconnu service policer connaître violence dégradation vol réunion déférer vendredi devoir présenter soirée juger instruction
trusted	cest échanger sms époux mettre puce loreille enquêteur analyser téléphone portable dalexia daval retrouver mort bois saôneetloire moi dernier retrouver trace message dater semaine drame témoigner difficulté coupler jeune femme reprocher mari limpossibilité davoir enfant révéler bfmtv terme employer virulent placer garder voir confronter élément accablant jonathann daval avouer étranglé femme cour dune disputer mettre examen meurtre conjoindre placer détention provisoire lalgarade sest dérouler domicile conjugal soir drame octobre couple venir rentrer dun dîner parent victimer jonathann daval initialement déclarer celleci lieu veiller cour audition simple témoin jonathann daval évoquer disputer épouse veiller disparition laltercation expliquer marque griffure voire morsure visible niveau bras soir meurtre finalement avouer jeune homme alexia venir main tenter maîtriser physiquement expliquer linformaticien an perdre contrôler étrangler scénario mari inquiet jonathann daval raconter ensuite sêtre trouver désemparer face dépouiller femme celleci changer rentrant parent porter short sweatshirt enfiler pair chaussette sport suite matin rapatrier voiture fonction garage transférer ensuite corps coffre recouvrer dun drap détailler bfmtv heure démarrer véhicule idée précis retrouver forêt desmoulins laisser corps celuici retrouver dissimuler branchage parti calciner mari nier tenter brûler dépouille entretemps échafauder scénario disculper servir téléphone victimer envoyer message beauxparents expliquer jeune femme partir courir rendre peutêtre visite passager mère part inquiétude voir alexia revenir prétendre footing adresser message épouser sen passer travail venir chercher imprimant sourire plaisanter dire faire apéro gratuit raconter parisien patron croiser jourlà midi jonathann signaler disparition dalexia gendarmerie stratagème mari éploré durer moi divulgation détail agacer procureure république besançon Edwige rouxmorizot enquêteur juger dinstruction prendre cest procureure prendre porter raison milieu folie médiatique oublier histoire quon dérouler manière indécent jouer destin dun homme bénéficier présomption dinnocence bafouer jour déclarer jeudi magistrate dune conférence presser
fake	catégorie important chiner dépasser étatsunis million véhiculer vendre étatsunis exemple loin million voiture vendre chiner constructeur automobile américain produire voiture vendre chiner partir communiste imposer taxer voiture luxer camion importer étatsunis poids économique rendre insoluble problème confrontation chine chiner responsable vente grand entreprise américain difficile confrontation trump xi jinping restriction accès chinois marcher américain heurter obstacle entreprendre américain vendre chine chiner marcher important multinational américain expliquer shen donner chiner immense pouvoir négociation domaine accord spectre politique vol propriété intellectuel américain chiner cour trump ordonner enquête représenter commercial américain robert lighthizer examiner politique chinois matière pi enquête courir conduire étatsunis porter plaindre omc mesure unilatéral inclure droit douaner restriction importation aube nouveau année dépenser consommation chine dépasser rapidement étatsunis classe moyen chinoiser jeune découvrir électronique grand public voiture mode
fake	mars soir commandement opérationnel armé rpd convoquer presser urgence transmettre communiquer important information transmettre édouard bassourine jour arrière directeur cia accompagner représentant service renseignement visiter ville avdeyevka situer territoire temporairement occuper ukraine événement question mener couverture familiarisation soldat américain hautrang situation opérationnel rpd réalité réunion autorité ukrainien recevoir ordre mettre point mars scénario provocation grave accuser république populaire donetsk rpd relancer hostilité patron américain kiev besoin justification auprès communauté international relancer guerre donbass etou justifier déploiement inacceptable casquer bleu région mieux opération fauxdrapeau obtenir résultat médiatiquement désirer ressemblance passer syrie attaque chimique attribuer preuve bachar elassad relancer guerre làbas fortuit … information obtenir rpd provocation mener combattant régiment ultranationaliste azov déguiser soldat rpd régiment azov déployer proximité novoazovsk fort chance provocation lieu portion front temps fort explosion lieu côté ukrainien ligner contact maryinka minute tard hélicoptère survoler zone violation total accord minsk craindre tentative attaquer aérien information transmettre édouard bassourine hélicoptère mener évacuation sûrement lié explosion lieu tôt endroit raison hélicoptère jamais devoir trouver accord minsk interdire engin voler grand tailler voler kilomètre ligne contact représentant rpd cccc demander osce enquêter faire pouvoir espérer divulgation plan américanoukrainiens permettre tuer œuf provocation prévoir victime éventuel pouvoir résulter
trusted	lundi ville christian estrosi tester application développer israël startup ancien ministre ehud barak appeler lorsqu témoin incivilité filmer incident temps réel centrer vidéosurveillance policer municipal lire plaindre dénoncer dispositif sécurité insuffisant lattentat nice devenir citoyen engager acteur propre sécurité sécurité collectif justifier vendredi christian estrosi présenter application qualifier révolutionnaire envisager déploiement grand écheler tester temps agent ville nice comité quartier membre réseau voisin vigilant transmettre image géolocaliser comportement suspect estrosi recherche cri matière technologie sécuritaire donner exemple application reporty maraudeur lorgner voiture stationnement fourgonnette décharger publique électroménager usagé cycliste renverser lire drame inciter revoir dispositif sécurité expliquer lun patron policer bilan moi appeler tombe centrer supervision urbain csu transmettre direct image bon qualité géolocaliser cibler caméra zoner dépêcher patrouille aton préciser mairie traducteur intégrer étendre utilisation touriste système messagerie instantané traduction automatique touriste étranger parler français faire comprendre police municipal niçois source application servir malais type appel courant mairie policer municipal peiner élucider faute savoir appeler interlocuteur opposition municipal socialiste immédiatement dénoncer démarche contestable fondre inadmissible forme … ressembler organisation processus délation généraliser nice policer municipal france effectif quadriller caméra vidéosurveillance kilométrer carrer record hexagone
trusted	agir organisation partir stéphane foll proposer généralisation voter électronique réforme système primaire seul pouvoir voter électeur préalablement inscrire partiplateforme ​pour olivier faure président groupe nouveau gauche assemblée présenter homme méthode congrès projet croire refonder doctrine moi motion suffire écritil introduction texte socialiste chemin renaissance députer seineetmarne proposer mettre pied partiplateforme lancement construire projet ps grand chantier thématique militant sympathisant trancher dire eurosocialiste membre famille politique porter espoir alternatif progressiste europe libéral dominer olivier faure souhaiter élection européen permettre construire victoire gauche européen autour coalition progressiste luc carvounas chantre gauche arcenciel ancien lieutenant manuel valls chantre gauche arcenciel version new look gauche pluriel dernier adopter pacte fondateur voir prochain élection européen municipal expliquetil texte progrès partager faire gagner gauche domaine économique social luc carvounas proposer exonérer tva bien nécessiter eau gaz électricité produit alimentaire supprimer niche fiscal créer suffisamment emploi luc carvounas rapprocher benoît hamon présidentiel reprendre proposition revenir universel vouloir interdire perturbateur endocrinien socialisme décomplexer emmanuel maurel député européen représenter aile gauche ps proposer socialisme décomplexer refonder socialisme xxie siècle enjoindre camarader devenir pleinement écosocialistes sortir maximum production sphère profit encourager modèle dépenser consommation retrouver sen temps long exhortetil imaginer exemple taxe kilométrer ajouter
parodic	débuter brainstorming société satisfaction propriété arthur croire hypnose falloir truc fort coke douter effet arthur banco confier aurélien poquetgatier collaborateur épreuve rail coke penché interrompre police rendezvous donner inviter mercredi studio plain saintdenis loger disposer gramme cocaïne invité pouvoir déjà commencer mettre ambiance exception faire loger carole rousseau saladier attendre tournage débuter vite arthur comprendre invité difficile gérer claudia tagbo toupie sol minute arrêter surprise général florent peyre bon blaguer chose arriver avril plateau télé heure tournage hervé guichard présent public ancien agent stups apprécier guère spectacle prévenir discrètement ancien collègue débarquer épreuve rail coke pencher droguer immédiatement saisir responsable production déférer parquet pari chance arthur tourner futur projet vendredi ecstasy devoir mettre boîte semaine prochain
parodic	gorafi magazine publier semaine entretien poigner poisson rouge partager inquiétude tristesse voir humain prisonnier aquarium reportage poisson âgé an résider île france définir amateur éclairer domaine comportement humain avouer temps observer individu prisonnier extérieur aquarium déceler signe inquiétant lieu poisson pointer doigt risquer surpopulation humain environnement confiner augmenter risquer maladie tension mâle expliquer poisson dénoncer également condition hygiène inhérent confinement impression air triste regarder petit œil dire vouloir rejoindre vouloir libre triste ajoutetil poisson vouloir engager faveur humain élevage naître captivité barrière verre vie connaître goût liberté indigne poisson produire petit bulle animal retrouver bloquer espace clore pouvoir aller vouloir expliquer poisson conclure interview happer épuisette géant enfermer sac plastique
