fake	recherche milliard poutine william browder directeur fondre investissement britannique hermitage capital évaluer richesse président russe vladimir poutine milliard dollar browder poutine riche bill gates homme riche monde milliard dollar estimer poutine accumuler milliard dollar bien acquérir malhonnêtement browder comité judiciaire sénat conserver argent occident argent occident risquer potentiellement geler confisquer ajouter financier président russe risquer personnellement tomber coup loi magnitsky donner droit imposer sanction citoyen entreprise russe impliquer abus droit homme flagrant browder pression adoption loi pouvoir guère instant jouer rôle important fin histoire browder avocat russe natalya veselnitskaya rencontrer fil président actuel donald trump jr an user écarter risquer poutine tomber coup loi magnitsky the washington examiner browder poutine attendre recevoir million dollar intermédiaire compagnie offshore appartenir violoncelliste sergei roldugin convenir noter browder sérieux problème justice russie condamner contumace an évasion fiscal activité fédération russie an browder adonner révélation nom apparaître besoin actualité inutile essayer tirer meilleur partir situation actuel législateur us prêt consacrer temps absurdité fondé diffamer président russe william browder parler énorme richesse diriger russe interview cnn février browder croire milliard dollar an pouvoir russie quantité argent pays gagner quantité argent dépenser école route hôpital argent bien immobilier banquer compte bancaire suisse action fond spéculatif gérer poutine copain vraiment ressembler discours bistrot stratège politique stanislav belkovsky interview die welt allemagne fortune poutine monter milliard dollar chiffrer devenir tard populaire militant opposition défunt boris nemtsov écrire brochure révélation poutine posséder palais villa hélicoptère avril the new york times écrire rapport secret cia mentionner fameux milliard dollar malheureusement article référer analyste politique russe stanislav belkovsky passer augmenter fortune président russe douzaine milliard dollar mars fonctionnaire trésor us apporter moindre preuve poutine investir compagnie commercer pétrolier gunvor pouvoir voir savoir fortune poutine adversaire politique délinquant pravdaru anton kulikov
trusted	interroger cnn spécialiste estimer fortune président russe milliard dollar lhomme riche monde tête dun patrimoine milliard dollar bill gates pâle figurer côté vladimir poutine dire dun spécialiste exact bill browder directeur général cofondateur fondre dinvestissement hermitage capital management estimer président russe posséder milliard dollar milliard franc interroger cnn lun principal investisseur étranger russie expliquer arrivé chiffre laméricain vladimir poutine amasser milliard grâce investissement nont faire école hôpital route lexpert ajouter quune bon partir fortune président russe trouver certainement compte suisse premier année régner russie poutine voler dargent quil partie penser quil lhomme riche monde lun riche monde grâce milliard dollar voler russie déclarer bill browder cnn
fake	monde livre explosif trump révélation sensationnel Donald mécher femme dormir chambre séparer couloir maison blanc fil aîné rencontrer avocat russe trump tower new york trahir patrie renverser issu élection présidentiel presque livrer contenir véritablement explosif sortir temps signature président Donald trump stratégie sécurité national etatsunis document périodique rédiger pouvoir fort administration militaire regard précédent publier administration obama administration trump contenir élément continuité substantiel fondamental concept mettre amérique rang sûr prospérer libre falloir volonté exercer leadership user monde concept exprimer administration obama précédent garantir sécurité peuple amérique diriger position rapport document stratégique administration obama parler agression russe ukraine alerte modernisation militaire chiner présence croissant asie document administration trump explicite chiner russie défier puissance influencer intérêt amérique tenter éroder sécurité prospérité dire auteur document stratégique abattre carte montrer véritable enjeu etatsunis risque croître perdre suprématie économique face émergence sujet étatique social rang chiner russie cellesci train adopter mesure réduire prédominance dollar user maintenir rôle dominer imprimer dollar fonder réel capacité économique étasunienne utiliser devise mondial chiner russie souligner document stratégique vouloir former monde antithétique valeur intérêt user chine chercher prendre place etatsunis région pacifique répandre modèle économie direction étatique russie essayer réacquérir statut grand puissance établir sphère influencer frontière objectif affaiblir influence étasunienne monder diviser allier partenaire véritable déclaration guerre battre outil puissance national assurer région monde dominer puissance estàdire faire sorte dominer etatsunis outil évidemment militaire user position supérieur souligner document stratégique administration obama posséder militaire puissance technologie porter géostratégique égal histoire humanité otan fort alliance monde stratégie sécurité national etatsunis signer trump impliquer italie pays otan appeler renforcer flanc oriental agression russe consacrer pib dépenser militaire celleci acquisition nouveau force arme europe partir guerre débattre téléviser thème électoral manlio dinucci
trusted	alaa alaswany egypte régime militaire pouvoir pays préparer scrutin présidentiel surprendre fin mars écrivain critique visàvis gouvernement estimer révolution poursuivre manière souterrain répression policier musellement médias mondialement connaître roman immeuble yacoubian acter sud écrivain égyptien alaa alaswany commentateur engager vie politique pays fervent soutien révolution janvier renverser président hosni moubarak dentiste francophone an – exercer banlieue caire – voix critique président abdel fattah alsissi opposition valoir censurer médias égyptien roman algoumhouria ka enna république dar aladab beyrouth paraître français acte sud interdire egypte élection présidentiel mars surprendre conduire réélection président abdel fattah alsissi bilan faitesvous mandat alaa alaswany pouvoir élection candidat etat monopoliser médias policer armer candidat chance retrait candidature général ahmed chafik victimer pression arrestation général sami anan principe dictature falloir tirer leçon histoire dictature débuter apporter projet améliorer vie connaître fin catastrophique egyptiens partager vision pardonner monopoliser pouvoir apporter changement positif société cas nasser président fondateur dictature égyptien populaire egypte discourir servitude volontaire etienne boétie décrire pays vivre dictature privé liberté émerger nouveau génération rêve jeune arabe
parodic	hier soir président lvmh bernard arnault recevoir nouveau distinction rang rentrer récemment top homme fortuné planeter grand patron français honneur devenir personnalité préférer connard grand patron bill gates mettre main pocher rembourser partir dette américain donneur leçon con déclarer connard réussite admiration malin déclarer connard parler homme délocaliser pays créer fondation défiscaliser continuer promouvoir marque indirectement détenir record français filial paradis fiscal devenir grand fortune français patron tarder réagir apprendre statut roi connard émouvoir recevoir récompenser célébrer semblable chose déclarer connard gagner pratiquement million euro heure
parodic	décider poser jalon organisation islam france emmanuel macron annoncer matin nom charger diriger opération agir femmerabbin delphine horvilleur directeur rédaction revoir penser juif tenou delphine horvilleur charger veiller création instance véritablement représentatif religion musulman régulation financement lieu culte nomination imam france remplacement religieux venir cible critique réseau social président république tenir répondre conférence presser organiser occasion choix rabbin permettre éviter division dispute inutile courant islam atil expliquer ajouter delphine horvilleur seconder mission curer moine bouddhiste cap emmanuel macron profiter conférence presser lever voiler principal chantier gouvernement expliquer nomination marquer tourner politique distance essentiel mener projet atil déclarer annoncer nomination jean lassalle tête conseil métropole grand pari lieu placer patrick ollier christine boutin robert ménard rapporteur respectivement mission information pma gpa accueil migrant
parodic	dépenser euro rapport propreté pari maire pari récidiver commander rapport pauvreté coût opération euro vouloir lutter efficacement pauvreté falloir comprendre expliquer anne hidalgo justifier commander rapport grâce rapport idéer précis nombre pauvre capital faire gagner temps rapport venir commander richesse pari atelle ajouter critiquer démarche curer prix sembler élever réalité tiers budget utiliser extrêmement pauvre difficile localiser logement expliquer conseiller ajouter falloir rémunérer correctement temps côté pauvre contraire indécent rapport édifier premier conclusion rapport pauvreté pauvre essentiellement ressourcer voire argent vivre modeste aimer voyage sortie préférer transport commun voiturer supermarché restaurant fier tête ville connaître grâce précieux rapport mieux mieux habitant confier anne hidalgo prendre nouveau conseiller circuler jour nuit capital voiturer observer évolution pollution
parodic	fin cauchemar million français subir fouet moi bouc manuel valls apparition public conseil etat réunir urgence statuer validité look finir trancher bouc manuel valls disparaître prochain jour encontre confier catherine bergeal secrétaire général institution moi mai effondrement partir socialiste manuel valls décider changer arborer bouc dégueuler montrer prendre tournant vie professionnel également personnel femme ancien ministre réussir joindre cacher joie téléphoner beau jour vie vivre enfer moi manuel comprendre polémique trouver beau homme bouc vouloir ressembler christophe maé adorer collier barbe robert sauver justesse conseil rappel robert échapper sanction français demander éradication collier barbe robert confier jeanmarc sauver vice président conseil etat savoir tête robert vivre urss milieu communiste manger pain eau décider monde collier barbe valls provoquer raison sanctionner moi prochain conseil etat pencher cas sensible puisqu agir accent anglais jane birkin irriter lieu chanteur vivre france an année
parodic	déclaration députer lrem sylvain maillard immense majorité sdf dormir choix edouard philippe tenter apaiser tension adresser sansabri chuter température ministre conseiller couvrir conseil judicieux mettre exécution premier concerner reportage température chuter semaine froid dangereux savoir analyser edouard philippe matin radio national devoir donner conseil sdf couvrir prendre carton france dispos carter bon qualité fabriquer union européen supermarché demander ramasser sdf mourir froid choix pourtant edouard philippe désolidariser député enfoncer clou affirmer tard savoir sdf mourir année rue causer froid choix choix couvrir garder image bad boy falloir prendre conscience santé passer style bon couverture valoir mieux petit pull petit pull exemple espérer sage parole ministre écouter année vie millier sdf dépendre
parodic	maire pau jouer décidément malchance jour échouer devenir roi manger galette fève foisci briser dent déguster simple crêpe savoir fève retrouver expliquer françois bayrou manquer brûler pointer doigt poêle chaud venir faire cuire crêpe venir étrangler avalant saliver mordre goulûment crêper oublier sentir chose extrêmement dur douleur atroce expliquetil ensuite téléphoner pompier déplacer voiture panner accident poursuitil décider hôpital pied glisser peau banane traîner salon
parodic	maire béziers incarner finalement nouveau jeanne arc commentaire incendiaire fachosphère réseau social dernier jour reportage annoncer jeanne arc métis fête johannique célébrer victoire pucelle anglais orléans provoquer déferlement haine organisateur finalement céder face menacer robert ménard incarner célèbre héroïne français heureux représenter jeanne arc aimer france détester étranger vrai maire béziers entraîner déjà an rôle samedi parcourir fier destrier rue ville chasser étranger confession musulman bannière épée anglais facile lourd mieux nourri sarrazin endurer confietil heaume relever rôle revenir droit vue paraître normal prendre femme membre fachosphère fermement opposer femme incarner jeanne arc sentir histoire pouvaiton lire réseau social
fake	captain america dévoilement nouveau ordre mondial serge beketch diviser cinéma américain groupe film film vaseliner vie supportable humanité déchoir exemple erin brockovitch film conspiration but disaitil croire conspiration exemple jason bourne paul greengrassmatt damon créer pièce faux terroriste irakien tuer monsieur facebook film hindou culture anglosaxonne aller expliquer ensuite dire serge créer terroriste monde rire nez dire trop … cinéma citer script jason bourne anglais agent expliquer patron agencer fabriquer numériquement patsie couvrir petit assassinat ami script facebook local – deep dream – inféodé agence us deep state irakien an créer compter bancaire document voyager emails monde content autorité tutelle debord décrire déjà part achéron léthé mourir régulièrement enterrer spectacle censé dormir attendant vouloir réveiller terroriste redescendre colline pirate revenir mer voleur besoin voler venonsen capitaine america créer génial scénariste autrichien kirbykurtzberg année presque superhéros us originer juif mission lutter nazisme lire simcha weinstein voir wikipédia httpsenwikipediaorgwikilistofjewishsuperheroes film série intéressant alluder opération paperclip élémentclé comprendre série prisonnier spécialiser récupérationrecyclage savant allemand évoquer hydre lerne combattre hercule hydra agence nom démon byron naître nazisme loin nazisme survivre croire livre estulin propos hydra répandre terreur chaos lire livre jérémy lehut comics us anéantir liberté résistance humain définition lucien cerise livrer gouverner chaos système oligarchique priver liberté argent vie protéger ordinateur inspirer totenkopf captain sky monde demain monde arriver jamais révéler principal humanité devoir liberté volontairement humanity needed to surrender its freedom willingly script web servir priver commencer liberté naître ordre naître ordinateur siècle livre digital mécher docteur arnim zola révéler hydra was founded the belief that humanity could not be trusted with its own freedom what we did not realize was that if you try to take that freedom they resist the war taught us much humanity needed to surrender its freedom willingly humanité résister prendre liberté prêt boétie tocqueville etat tutélaire bienveillant doux ensuite ligner hydra noyauter agence shield créer attentat revoir opération espadon travolta sortir septembre crise récolter guerre phraser terrible and when history did not cooperate history was changed revenir lucien cerise gouverner chaos hydra created world so chaotic that humanity is finally ready to sacrifice its freedom to gain its security carrément nouveau ordre mondial once the purification process is complete hydra new world order will ariser we won captain guider septembre mieux … capitaine america soulèvement technicien paresseux sauf monde heureusement avonsnous captain russia captain chiner préserver volonté nihiliste folle chaotique agence débile dangereux gouverner dangereux amérique étasunie … nicolas bonnal
trusted	angers choir condamner prélever rein dun patient consentement ju twitter publier — mettre jour choisir donner rein frère attente greffer changer avis veiller chambre hôpital homme année attaquer justice choir angers prélever organe consentement rapporter ouestfrance faire dérouler appel homme venir obtenir indemnité euro décider cour administratif appel nantes double monter accorder instance procédure arrêter journal établissement santé condamner tenir compter rétractation absence vérification maintien consentement donneur constitutif faute homme pourtant prévenir tardivement femme téléphone personnel médical choix client arriver accepter procédure médical arrêter dénoncer avocat requérir audience septembre
fake	médias français silencer radio nuage radioactif sest arrêter frontière source articler fin incrédule penser presse médias informer grand source étranger cest véritable coup tonnerre symbolique quà stade évidemment nest cest explosif lhistoire vraisemblablement court leuro pays cercler rigueur exemplaire monnayer fort paysbas poser sérieusement monde question savoir sil rester leuro officiellement enquêter possibilité dabandonner leuro ami autorité néerlandais approuver lancement dune étude sil raisonnable paysbas lun pays phare lire quitter zone euro crise deutsche bank révéler dysfonctionnement zoner euro milieu politique paysbas demander étude question savoir pays devoir rester membre zoner euro également lintention lancer débattre approfondir élection législatif lieu moi prochain motion présenter principal partir dopposition démocrateschrétiens adopter lunanimité jeudi autoriser lancement lenquête superviser conseiller juridique gouvernement conseil détat lenquête examiner sil néerlandais quitter zone euro déclarer députer pieter omtzigt membre lappel chrétiendémocrate cda également indiquer linitiative motiver inquiétude tau dintérêt ultrabas banquer central européen bce défavorable épargnant néerlandais retraiter doute légalité programmer dachat dobligations lidée quitter zone euro soulever contexte vague montant deuroscepticisme europe paysbas partir politique rater occasion jouer carte faveur élection législatif lieu mars france débattre leuro fasciste raciste xénophobe inviter remarquer pragmatisme ami néerlandais dire répéter citer churchill régulièrement leuro cest changement churchill dire quil valoir mieux prendre changement main quil prendre cou passetil côté paysbas dautre vieux gros sen bvgbs savoir dire pépé homme avertir valoir gars préparer valoir précis grandpère repousser allemand gars régiment jour an officier mort déserteur daccord ny rapport direct cest insister vie préparer lon espérer meilleur valable niveau individuel lest autant niveau collectif gouverner cest prévoir problème sauter œil observateur objectif lucide pays déni réalité dérangeant élite fantasmer réalité nexiste battre devenir président vraisemblablement affronter fin leuro catastropher financier faillite pays franchement falloir totalement inconscient inconsistant vouloir postelà momentlà cest sacerdoce poursuivre métaphore chrétien boire calice jusquà lier oui leuro exploser épargne information apprendre quévidemment latitude média sérieux cest oui leuro sauter exploser épargner prendre tourmente nont penser naïvement jai commentaire typer quils risquer minquiéterai découvrir penser intelligent sortir genre sornette problème voyezvous cest dargent fragile préparer fragile avezvous moindre idéer vouloir signifier explosion leuro avezvous moindre idée conséquence concret dune sortir préparé leuro panique pauvre rassurer dire quils nont dépargne perdre nest évidemment quune partie problème incommensurable devoir affronter cas sortir leuro contrôler létat français inspirer préparer éventualité pourtant nen faire nen faire sang contaminer nen faire nuage tchernobyl chose savoir faire quil démontrer travers décennie cest organiser protection petit caste mamamouchi quils risquer protéger mentir effrontément population dupe nattendez létat sauver aller mal prendre propre responsabilité propre précaution cest justement aider voir clair jai écrire moi dossier spécial survivre leurocalypse donner clef homme avertir uniquement homme préparer sadresse pauvre quaux riche figurezvous rayon supermarché vide problème immédiat livret pouvoir procurer rapport survivre leurocalypse abonner lettre stratégie accès prochain moi dossier lettre déjà éditer rapport survivre leurocalypse déjà tard préparezvous
trusted	conducteur ressortissant espagnol relâcher soirée nest suspect lenquête indiquer jeudi policer rotterdam communiquer policer néerlandais annoncer relâché jeudi conducteur camionnette immatriculer espagne contenir bonbonne gaz interpeller veiller lannulation dun concert rock ville portuaire rotterdam raison dune menacer terroriste conducteur nest suspect lenquête conducteur ressortir espagnol relâcher soirée nest suspect lenquête indiquer jeudi policer rotterdam communiquer individu interpeller jeudi heure brabant sud pays détention suspecter dêtre impliquer préparation dun attentat terroriste souligner frank paauw conducteur entendre reprendre mercredi jeudi interpeller mercredi mètre salle concert maassilo situer zone portuaire sud ville prévoir concert groupe rock californien allahlas lien conducteur menacer soirée interrogatoire confirmer quil ny lien conducteur menacer soirée préciser police technicien posséder attestation transport bonbonne gaz sembler linfluence lalcool sest tromper route indiquer auparavant chef policer rotterdam frank paauw service déminage fouiller camionnette nont découvrir côté bonbonne quune perquisition domicile livrer lien moment menacer terroriste maassilo expliquer policer affaire mauvais homme mauvais endroit mauvais moment mauvais contenir véhicule quà terrorisme estimer frank paauw
fake	mesdames permettre donner conseil rapporter argent prochain accoucher demander chambre hôpital rezdechaussée doute aller demander important transfert nourrisson penser fou laisser expliquer … accoucher demander chambre rezdechaussée soir venir essayer accoucher journée … remettre nourrisson sœur cousiner amie…qu appeler médecin déclarer accoucher chezelle médecin faire examen réceptionner nourrisson chambrer hôpital rester sagement regarder stupide émission télévision tour jouer tour borowski auteur devenir fou falloir changer souhaiter rester crédible regarder paul reac écrire échanger nourrisson réception saoul mesdames avezvous nourrisson certificat naissance nourrisson allocation arnaquer caf … oui longue contrôleur caf comprendre stratagème imaginer répéter stratagème nombre ajouter appartenir communauté fermer style … style communauté suffisamment fermer faire peur contrôleur style autochtone pâle stratagème malin avouonsle mettre place femme appartenir communauté gitan perpignanaise faux bébé naître nonnés permettre recevoir € prestation social rappelonsle € bébés…jamais naître lundi femme condamner moi prison surseoir € amande € allocation familial toucher vraiemère supprimer question demeure caf atelle stratagème simplement enfant faussement déclarer scolariser cause … aimer histoire france
trusted	plan présenter jeudi représentant syndical inscrit cadre réorganisation métier groupe nestlé france supprimer poste service administratif prochain année indiquer vendredi groupe engager proposer reclassement salarié concerner voir proposer poster entreprendre déclarer pierrealexandre teulié directeur général nestlé france employer total gérer transformation licenciement filial français géant agroalimentaire suisse lever pied embaucher parvenir proposer reclassement concerner atil indiquer vouloir gérer transformation licenciement insister responsable nestlé plan présenter jeudi représentant syndical inscrit cadre réorganisation métier groupe france annoncer janvier nestlé france souhaîte regrouper siège social site historique noisiel disperser région parisien site situer issylesmoulineaux hautsdeseine sud pari tâcher administratif support toucher informatisation numérisation simplification indiquer pierrealexandre teulié devoir adapter faire évoluer travailler atil affirmer syndicat service ressourcer humain rh lentreprise toucher devoir perdre dun tiers effectif passer salarié lhorizon plan annoncer distinct plan départ volontaire nestlé négocier actuellement cadre projet fermeture centrer recherche filial galderma sophiaantipolis rapatriement suisse projet annoncer octobre voir effectif laboratoire dermatologique passer
trusted	cause monter eau garer fermer mercredi capital tronçon central ligner rer pari rester fermer jusquau février minimum raison croire seine annoncer faire sncf dimanche aprèsmidi croire rester niveau probablement semaine stade garantir réouverture gare intramuros ligner lundi février tôt expliquer alain krakovitch directeur général sncf transilien répercussion yvelines saintmichelnotredame muser orsay invalide champdemars avenueduprésidentkennedy boulainvilliers fermer mercredi raison monter eau station pontdel alma déjà fermé travail sncf interrompre trafic rer gare yvelines versailles chantier saintcyr saintquentinenyvelines cour eau passer inonder station javel sncf décider maintenir train versailleschâteaurivegauche raison heure sncf utilisateur concerner fermeture station transporter rer
