fake	loin temps voiture figurer bon place symbole opinion commun représenter moyen accéder former liberté gauche institutionnel écolo sécuritaire automobile voir accabler défaut polluer sale taire expression individualisme bref moyen détourné accuser choix conduire assumer principe réalité faire vivre accuser juillet politique consister empêcher conducteur vieux voiture moteur diesel conduire pari modèle moteur essence polluant continuer pouvoir circuler ignominie gouvernement compter imposer nouveau limitation vitesse route national départemental kmh lieu kmh anodin pouvoir paraître voir fil rouge commencer inscrire profondeur stigmate voyant chasse prolétaire orchestrer logique continuer contrerévolution … gouvernement raison raison ignorer représentation vivre actuellement propre période crise cesser rebattre boucle oreille croire campagne candidat élection insécurité indépendamment acte terroriste règnerait partout maître partout cesser mesure présenter dorénavant viable prétexter octroyer davantage sécurité mesure relatif coder route déroger règle contraire lieu étayer clairement problème lier vitesse route contenter insister nécessiter sécurité limiter davantage vitesse légal autoriser jeu difficile prêt militer insécurité voiturer autant agir mettre accent vie enfant parent conjoint or accepter regarder lucidité objectivité faire accepter paradigme insécurité router lier vitesse réel contredire mélodrame ambiant route vitesse autoriser savoir autoroute mort recenser année pourtant autoroute retrouver grand nombre contrôler vitesse excès vitesse intervenir instance cas accident route usage alcool stupéfier dernier évidemment coupler vitesse réalité causer majorité accident route consommation drogue voler manque infrastructure viable contraint moyen financier tourner route départemental correctement aménager autoroute présenter risque minimal usager lumière faire falloir comprendre intérêt rechercher sécurité profit objectif entreprendre vinci majorité autoroute appartenir dominique villepin vendre expression clair lutter classe nom prendre racine hégémonie culturel contrerévolutionnaire classe dirigeant voiturer instrument liberté moyen oppression producteur falloir rétablir voiturer moyen locomotion commun automobile outil déplacement accessible point voir financier technique pratique majorité point falloir insister voiture moyen accéder loisir partir vacance moyen production permettre travailleur lieu travail occasionner nombre frais réel indemnité prévoir voiture demeurer équipement nécessaire production difficile passer risquer perdre emploi mode production plaisir acheter modèle besoin temps exister beau moyen transport bien consommation servir production permettre uniquement propriétaire jouir luxe offre songer cas explicite yacht exemple détourner fonction locomotion mer … voiturer quidam peiner entrevoir sereinement longue distance itinéraire établir aller lieu travail inversement voiturer moyen locomotion force productif aisé discriminer attaquer condamner connaître aéroport pays rendre lorsqu disposer jet yacht priver simplement appartement suffisamment situer ville pouvoir pied vélo lieu affaire représenter roseau monde côté étendre émerger composer ensemble condamner automobile condamner producteur opprimer choix route boucher kmh façon atteindre condamner travailler loin famille devoir prolonger heure attenter condamner contrôler cesse vitesse pointer pied frein occasionner lassitude mental fatiguer conséquent vitesse ellemême route désert risquer recevoir amende pénalité peutêtre déjà perçu salaire matin retard minimal peur dépasser limitation vitesse autant minute sommeil combler temps échapper emprisonner idéologie sécuritaire gauche écologiste combat devenir écologiste privezvous voiture privezvous emploi privezvous argent privezvous famille privezvous vousmêmes terre mieux porter loin idéer faire fauxprocès écologie politique déjà parler repriser écrire vidéo contraire agir davantage faire constat objectif alliance discourir classe dirigeant viser sécuritaire pensée prétendument gauche écologique sauce hidalgo pari voiturer racheter qatar effort produire minimiser trace carbone sommer prolo vélo grand capital international évertuer polluer humanité entier spoliation constant produire prolétariat partir monde finalement signaler jacque brel peutêtre pollution moral politique époque attirer attention monde soidisant libre extorsion plusvalue acmé produire catastrophe écologique conséquent songer quantité pétroler déverser mer magnat baril législation international trouver redire aisé làencore voir paille œil voisin conseiller puritanisme précéder nombre attitude viser protéger planète priori droit habiter salaud pauvre réprimer automobiliste soutenir déjàlà fonctionnel alternatif transport heure direction sncf annoncer suppression emploi question transport cœur préoccupation puisqu vitesse conduire fort morbidité route nombre kilomètre parcourir or meilleur solution remédier trouver transport commun bât blesser capital poursuivre logique systématique permissivité consommateur répressif producteur trouver réalité moment publicité manquer capitaliser aspect libérateur automobile face alternatif collectif moment capital retirer investissement frais occasionner véhicule laisser usager véhicule charger entretien voiture servir lieu emploi politique masquer réel profit apparence manquer lever attarder question politique sécurité routier réel consister investissement conséquent transport public ferroviaire transport marchandise finalement privatisation massif courir secteur transport public révéler cause mortalité route capital année choix routier extraire complètement champ transport organiser manière collectif or réduction massif trafic permettre déjà minimiser risque mortalité route lieu politique flicage permanent instaurer incriminer automobiliste retrouver priori dépourvu réponse lorsqu devoir faire face privation liberté reconquête liberté constat amer situation vie insupportable héritage laisser marque rouge quasi indélébile pardonner classe dirigeant assister instauration pouvoir oser néologisme partialitaire notion totalitarisme point vue étymologique historique renvoyer davantage idée totalité emporter partir bref démocratie réel réaliser commun inverse partialitarisme prendre habit habituellement décrire totalitarisme nom politique capitalisme moyen besoin minorité octroyer droit retirer majorité minorité oser nommer privilégier majorité celleci entendre défendre poursuivre droit conquête social agir partialisme abject service minorité détenir pouvoir nombre liberté politique réduire peau chagrin insécurité route urgence … etat droit céder place contrôle permanent faire erreur appuyer pédale accélérateur considérer criminel pollueur beauf mauvais électeur … cadre temps jamais prolétaire pays prendre conscience classer renouer liberté ontologique constituer collectif détour politique kmh souvenir vague vitesse engendrer révolution qualitatif nécessaire
fake	manger chose plein sucrer papille instinct cerveau remarquer activation système récompenser nest rappeler organisme traiter substance addictives lalcool nicotine surcharge sucrer monter flèche niveau dopamine laisser envie nicole avena expliquer bonbon friandise devoir consommer modération
fake	dieselgate filtergate monde mettre lumière vendredi février plaindre déposer février comité national tabagisme cnct viser filial français cigarettiers viseur système microtrous filtre faire baisser tau substance dangereux uniquement cigarette tester machiner cntc marquer cigarette pouvoir contenir nicotine goudron test déceler franceinfo pencher dossier potentiellement embarrassant cigarettiers accuser cigarettiers daprès monde cnct accuser british american tobacco philip morris japan tobacco imperial brand mettre danger délibérer dautrui tau officiel goudron nicotine mesurer test actuel largement inférieur réalité plaindre cntc consulter monde teneur réel goudron source supérieur goudron supérieur nicotine truquer test contrairement dieselgate éclabousser volkswagen logiciel truquer résultat modification présumer passer simplement filtre cigarette euxmêmes dernier présent quasitotalité cigarette vendre marché constituer microorifices invisible lœil nu dispositif fumer inhaler ventiler biais filtrer sopère théorie dilution fumer substance contenir réalité cnct dilution sopère machiner fumer règlementaire mesurer substance cigarette fumeur résultat contrairement machiner fumer fumeur mettre doigt lèvre filtrer trou boucher détailler franceinfo professeur yves martinet président cnct tau goudron supérieur goudron supérieur nicotine aujourdhui cigarette comporter perforation invisible filtre souligner cnct vérifier cigarette munir filtrer trouer yves martinet inviter fumeur isoler filtrer enlever quil contenir poser papier lampe torcher puissant marque compter jusquà ligner microtrous pratique estelle courant cest phénomène connaître confirmer yves martinet connaître cnct baser recherche ressourcer document appartenir lindustrie tabac cest observer propre document quon sest rendre compter létendue scandale sanitaire ajoutetil déjà justice suisse voir saffronter british american tobacco concurrent philip morris rj reynolds dernier accuser davoir mettre marcher cigarette alléger goudron nicotine sagacent communication concurrent valoir juger mai indication figurer emballage cigarette barclay exact cigarette tester moyen dune machiner standardiser résultat totalement cigarette barclay fumer bouche humain évoquer canal périphérique munir filtre monde rappeler quen lhistorien science robert proctor consacrer chapitrer livre golden holocaust conspiration industriel tabac filtrer trouer côté centre réaliser test laboratoire national métrologie dessai agréer gérer contrôle france expliquer monde test mener normer vigueur mesure nest pris cigarette fonction présence microorifices filtre lobjectif plaindre cnct annonce biais communiquer poursuite pénal également initier dautres pays paysbas suisse soutien dassociations malade lobjectif cest quavec procès démontrer lindustrie tabac tromper inqualifiable terme comportement assurer yves martinet mai tau goudron nicotine inscrire paquet neutre cest exact expliquer monde pierre kopp lavocat cntc jusquà dater fumeur tromper quantité goudron nicotine exposer faire prescrire fondement plaindre évoquer lavocat duperie institution sanitaire teneur goudron nicotine monoxyde carbone légalement excéder seuil présence microorifices ventilation tromper autorité sanitaire effectuer contrôle ad hoc manière crédible réagir cigarettiers contacter franceinfo seita branche imperial brand souhaiter commenter procédure moment mesurer recevoir notification plaindre reprécisons respecter norme européen cigarette contrôler laboratoire indépendant agréer etat laboratoire national lne philip morris également contacter franceinfo souhaiter faire commentaire japan tobacco international surprendre apprendre presse matin plainte déposer opérer contrôle france pays commercialiser produire conformité loi produire objet contrôler régulier autorité sanitaire british american tobbaco apprendre nouveau presse communiquer presser vendredi groupe affirmer quen france standard iso commission européen précis teneur goudron nicotine monoxyde carbone composer produire tabac mener propre mesure faire objet contrôler indépendance laboratoire national métrologie essai lne
fake	équipe international scientifique travailler orque vivre captivité parc marineland antibes alpesmaritimes animal reproduire son langage humain observation scientifique publier proceedings of the royal society orque étudier captivité capable articuler son imiter orque être humain précis josep call université st andrews grandebretagne participer étude résultat expliquer orque apprendre son articuler orque élaborer propre langage ajoutetil orque mammifère apprendre son cas orque an appeler wikie vivre captivité parc marineland antibes agir animal sauvage animal entraîner donner spectacle visiteur sonorité reproduire orque loin parfaitement imiter dernier apprendre répéter mot hello bye bye ‘ objectif scientifique entendre apprendre cétacé voir point dernier pouvoir imiter signal sonore totalement nature animal capable reproduire son émettre espèce courir oiseau mammifère exception homme primate cétacé expliquer josé zamoranoabramson chercheur université complutense Madrid espagne principal auteur étude expérience mener scientifique montrer point orque douer apprentissage vocal aider mieux comprendre comportement nature étude scientifique également démontrer capacité orque reproduire langage dauphin futur étude expérimental imitation son produire eau congénère nécessaire établir fermement rôle apprentissage social dialecte vocal orque nature … voir grand potentiel approcher analytique étude comparatif apprentissage vocal application varier fonction objectif étude son étudier système production vocal espèce conclure chercheur étude dernier souhaiter effectuer nouveau expérience domaine avenir
trusted	emmanuel macron proposer juin accueillir projet rechercher cadre accord pari climat … appel entendre face retraire annoncer etatsunis accord pari climat france proposer juin accueillir projet rechercher climatologue moitié américain acter candidature aton apprendre vendredi auprès cnrs millier enregistrer site internet opération make our planet great again annoncer er juin président français emmanuel macron correspondre critère spécifique pouvoir réellement postuler million disponible projet invitation lancer annoncer donald trump retrait etatsunis accord pari viser contenir réchauffement pari annoncer mijuin débloquer million euro financer projet rechercher france somme équivalent également versé institution recherche accueillir chercheur pouvoir déposer dossier candidat devoir titulaire thèse an établir étranger travailler science climat observation compréhension système terre science technologie transition énergétique devoir également engager projet an minimum chercheur août déposer dossier constituer information cv réalisation scientifique dater candidature complet déposer annoncer anne peyroche directeur général déléguer science cnrs etatsunis représenter sélection total émaner citoyen américain chercheur résider etatsunis nationalité représenter miseptembre sélectionner meilleur parcours académique chercheur détailler anne peyroche travailler actuellement etatsunis français travailler etats unir candidat expérience inférieur an thèse expérience supérieur candidat femme
trusted	ignorer heure graviter blessure circonstance drame sest produire aprèsmidi dimanche enfant chuter mètre tomber dun télésiège​ domaine skiable braitaz chapelled abondance station situer hautesavoie chuter descente télésiège dauphiné libérer skieur an tomber descendre télésiège petit blesser prendre charge secourir héliporter hôpital barrière sécurité télésiège atelle tôt lenfant étaitil bord enquêter comprendre circonstance jeune skieur glisser
trusted	seiner continuer lent monter pari samedi attendre pic croire fin weekend situation améliorer amont capital indiquer vigicrues vendredi pic prévoir situer mètre weekend vigicrues affiner samedi prévision mètre dimanche soir tôt lent décrue monter petit lente prévoir maximum décaler soirée dimanche lundi alentour métrer déclarer afp porteparole organisme surveillance rachel puechberty monter redescendre lent crue marner lent niveau seiner persister douzaine heure pari dimanche lundi décrue prendre temps affluent hausser amont capital situation améliorer petit petit vigicrues abaisser samedi vigilance jaune orange auparavant tronçon cour eau bassin parisien seiner amont département aube yonne aval yonne seineetmarne armançon aube côted or yonne propagation croire affluent niveau seiner pari rester orienter hausser weekend niveau maximum légèrement inférieur atteindre croire juin prévu confirmer vigicrues aval pari boucle seiner hausse poursuivre semaine ajouter organisme surveillance évacuation total îledefrance évacuer préfecture policer abonner million priver électricité chiffrer monter enedis gestionnaire réseau seineetmarne commune toucher restriction usage eau potable école fermer route partiellement couper yvelines centre hospitalier meulanles mureau soigner patient évacuer vendredi soir gare parisien rer bordure fleuve rester fermer samedi nouveau ordre météo améliorer éviter prévision favorable semaine venir pluvieux provoquer monté eau météo france laisser samedi département vigilance orange raison croire bassin seiner saône affluent nombrer baisser croire important éviter hiver savoir scénario catastropher croire historique seiner atteindre mètre
trusted	économiste rappelletil tendance caractériser porter réglementation simple question expansion contraction pouvoir économie politique autorité contracte intérêt priver combler vide horreur absence pouvoir pouvoir entreprendre voir œuvre relater employeursemployés relation instaurer entreprendre fournisseur voire client problème entreprendre exercer pouvoir partir conflit autorité professeur droit plateformes simple participant marché détenir estàdire capable exercer contrôle réglementaire condition imposer vouloir vendre bien service entremettre octroyer rôle gouvernemental remplacer logique souveraineté territorial souveraineté fonctionnel domaine fonctionnel location appartement transport passer commerce soumettre contrôler entreprendre démocratie pasquale prendre exemple airbnb airbnb utiliser méthode baser donner réguler efficacement offrir location administrer promoteur souveraineté fonctionnel estimer système notation ligne pouvoir demain remplacer système licence autorisation expliquer exemple nick grossman articler consacrer réguler donner passage souveraineté territorial souveraineté fonctionnel créer nouveau économie politique numérique estimer frank pasquale amazon géant commercer électronique infrastructure essentiel nombre entreprendre dépendre souligner chercheur lina khan linamkhan directeur politique juridique open market institute association chercheur journaliste opposer monopole articler paradoxe anticoncurrentiel amazon amazon présent échapper loi américain pratique anticoncurrentielles cadre anticoncurrentiel définir xxe siècle adapter réalité cadre viser protéger consommateur prix élevé or domination amazon reposer entente prix élever voir également articler distorsion marcher risquer collusion machine mesurer pratique anticoncurrentielles principalement angle prix sousestime risquer éviction acteur forme monopolistique intégration secteur activité enseigner comprendre plateformes accumuler pouvoir essentiel estimer pasquale meilleur service emporter clamer facilement tenant libre marché domination fille mérite expliquer pasquale critère qualité entrer ligne compter atteindre taille critiquer mettre place service favoriser éliminer absorber concurrence domination amazon montrer effet réseau autorenforcent plateforme incontournable nouveau plateforme potentiellement entrer marcher moment possibilité éloigner mesure amazon grossir souligner bruce schneier évoquer gafer seigneur féodal sécurité vrai matière commerce estimer pasquale pouvoir prêter serment allégeance gafer client fournisseur souligner promoteur libre marché imager professeur droit spécialiste consommation rory van loo roryvanloo articler entreprendre palais justice plateformes capable mettre place mécanisme évoluer règlement différend régler conflit acheteur vendeur gain efficacité petit créance risquer opacité dissymétrie condition contractuel modalité décision difficulté imposer recours collectif voir recul étatsunis monter procédure arbitrage contourner tribunal développement condition général utilisation unilatéral appliquer action contractuel régir existence location appartement contrat travail abonnement service ligne … pointe livre margaret jane radin souligner recours contrat dégrader noter consentement … autant indice montrer recul principe judiciaire matière litige lier consommation constat dresser juriste alain supiot livre gouvernance nombrer poindre limite substitution règle ordre public droit profit contrat individuel pasquale individu tourner rationnellement puissance plateformes imposer ordre doctriner juridique libertaire retrancher renforcer dynamique mener étiolement pasquale évoquer titre exemple polémique fleurir récemment autour recherche amazon siéger social entreprise donner lieu terrible surenchère proposition partir ville américain aller incitation fiscal nourrir innombrable passedroits pasquale voir signe schizophrénique transfert pouvoir etat entreprendre municipalité affaiblir manquer revenu fiscal maintenir service public qualité lutter accueillir entreprendre reine optimisation fiscal acheteur vendeur ligne compter amazon régler différend chercher meilleur prix pouvoir amazon demain gouvernement fédéral luimême confier fonction central achat amazon expliquer david dayen the intercept professeur droit jon michaels jondmichaels auteur coup constitutionnel privatisation menacer république américain menacer séparation pouvoir ellemême fonder achat critère coût invitation poursuivre approvisionnement éthique nombrer achat gouvernement américain frank pasquale solution limiter pouvoir amazon difficile mettre ordre jour superpuissance acquérir amazon commercer précédent esquissetil rapidement conclusion pointer rapport critique institut autodépendance local souligner amazon monopoliser économie détruire emploi fragiliser communauté … organisation politique économie empêcher souveraineté fonctionnel saper souveraineté territorial cœur démocratie propos rappeler économiste ariel zerachi maurice stucke rendre compter heure sénateur démocrate plancher réforme loi antitrust nombrer publication américain interroger ressembler nouveau législation question incidence utilisateur service audelà étatsunis wired nitasha tiku constater titan silicon valley croître entrave législation antitrust considérer comportement anticoncurrentiels prisme effet consommateur savoir falloir remettre plat loi antitrust américain inquiéter acteur politique libéral américain économiste carl shapiro grand entreprise acquérir entreprendre hautement performant marché adjacent concurrence diminuer domaine technologique expliquetil citer rachat youtube doubleclick google instagram oculus facebook linkedin microsoft responsable application loi anticoncurrentielles devoir attentif fusion estimer shapiro cas petit entreprise racheter pouvoir venir concurrencer avaler or soulignetil achat whole foods amazon acquisition média social tbh facebook donner lieu examen détailler évaluateur regarder fusion baser norme élastique partir marcher cumuler sectoriel whole foods amazon représenter marché américain alimentation analyste ben thompson autorité antitrusts peiner apprécier effet réseau commission fédéral commercer américain ftc instagram application photo revenir thompson rachat instagram whatsapp permettre facebook renforcer publicité numérique anant raut ancien avocat ftc réformer analyse fuser également impliquer prêter attention signal alarme violent nécessairement loi antitrust indiquer comportement anticoncurrentiel fusion application médias social américain dispositif mettre placer union européen modeler suivre transaction précédemment approuver permettre ue infliger amende million dollar facebook induire régulateur erreur acquisition whatsapp entreprendre affirmer vouloir combiner donner compte fb wa fin association défense consommateur américain porter plainte ftc google entreprendre combiner donner doubleclick appel limiter pouvoir entreprendre silicon valley venir promoteur euxmêmes spécialiste marketing scott galloway profgalloway auteur adn cacher amazon apple facebook google inviter facebook séparer instagram whats app exemple lieu grand entreprendre écosystème riche stimuler croissance emploi actionnaire … maurice stucke ariel ezrachi souligner récemment loi antitrust rester figer question argument compréhensible consommateur pression politique traverser camp politique surpuissance gafer poser problème croître trouver modalité adéquat régulation voire démantèlement simple
